id,title,description,price,sale_price,availability,condition,image_link,link,brand,google_product_category
64,"Lexi Curved Night Stand ","Soft curves. Bold presence. The Lexi Nightstand brings a refreshing twist to classic bedroom design with its gently curved silhouette and smooth, sculpted finish. Designed to add both elegance and functionality, Lexi stands out with its seamless lines and graceful shape.

Perfect for contemporary or modern glam interiors, this nightstand features a spacious drawer and an open shelf, offering both beauty and practicality.

Key Features:

Unique curved design for a soft, elegant look

Smooth finish with a sculpted edge

One spacious drawer and open shelf

Sturdy build, perfect for bedside essentials


Elevate your space with the charm and sophistication of Lexi — where design meets function with a gentle curve.",8000.00 KES,null,in stock,new,https://res.cloudinary.com/dtz6b2pip/image/upload/v1748372981/20250527_100714_fnc9sp.jpg,https://bobbyfurniturekenya.com/product/64,Generic,Bedroom - Nightstands
124,Kids Pink & White Bed with Storage Drawers,"This kids’ pink and white bed is designed with charm, safety, and functionality in mind. It features raised side rails for added protection, beautifully curved ends, and tall decorative posts that give it a classic, elegant look perfect for a child’s bedroom. The bed includes spacious pull-out storage drawers underneath, ideal for toys, clothes, bedding, or daily essentials. Built from strong hardwood and finished in smooth paint, this bed provides durability, stability, and a bright, playful style that kids love.",32000.00 KES,null,in stock,new,https://res.cloudinary.com/dtz6b2pip/image/upload/v1768921882/20251202_144154_lubis8.jpg,https://bobbyfurniturekenya.com/product/124,Generic,Kids Room - Baby Cots
125,Luxury Bubble-Tuft L-Shape Sofa,"This luxury bubble-tuft L-shape sofa features a bold, modern design with deep, oversized cushioning for maximum comfort. The unique bubble-tuft pattern gives it a premium, stylish look while delivering a soft, lounge-like seating experience. Perfect for spacious living rooms, entertainment areas, studios, and modern homes, this sofa brings both comfort and a strong aesthetic presence. Built with a durable hardwood frame and high-density foam, it guarantees long-lasting support and everyday relaxation.",65000.00 KES,null,in stock,new,https://res.cloudinary.com/dtz6b2pip/image/upload/v1768923243/20251212_104558_ubbpti.jpg,https://bobbyfurniturekenya.com/product/125,Generic,Living Room - Sectional Sofas
68,"Frozen - Themed Toddler Bed "," Transform your child's room into a magical retreat with our stunning Frozen-themed toddler bed! 

Featuring a charming design with spacious drawers for storage, this bed is perfect for your little princess. Made for comfort and style, it ensures sweet dreams every night.",50000.00 KES,null,in stock,new,https://res.cloudinary.com/dtz6b2pip/image/upload/v1748863859/-5317007678536545466_121_lg2etu.jpg,https://bobbyfurniturekenya.com/product/68,Generic,Kids Room - Baby Cots
91,8-Seater Oval Dining Table Set,"This 8-seater oval dining table set combines elegance, comfort, and durability for a premium dining experience. The solid wooden table features a smooth, polished oval top supported by a strong pedestal base. Paired with eight plush, upholstered chairs with tufted backs and studded detailing, this set delivers both style and superior seating comfort. Ideal for family dining rooms, restaurants, and modern homes looking for a spacious and sophisticated setup.",78000.00 KES,null,in stock,new,https://res.cloudinary.com/dtz6b2pip/image/upload/v1768899661/20250314_141138_mcvjcs.jpg,https://bobbyfurniturekenya.com/product/91,Generic,Dining Room - Eight Seater Dining Sets
160,4by6 Brown Chester Bed,"Transform your bedroom into a haven of style and sophistication with our premium upholstered bed collection. Featuring a stunning blend of bold colors, elegant curves, and fine craftsmanship, each bed is designed to make a statement while offering unmatched comfort. Choose from rich velvet finishes like deep royal blue for a regal touch, or go for the clean, modern appeal of cream tones with gold accents.

These beds are crafted with high-quality wood frames and padded with durable, soft upholstery that adds both structure and style. From sleek vertical tufting to gracefully arched headboards, every design element is thoughtfully chosen to suit both contemporary and classic spaces.",28500.00 KES,null,in stock,new,https://res.cloudinary.com/dtz6b2pip/image/upload/v1747965249/20250523_045121_pv8qap.jpg,https://bobbyfurniturekenya.com/product/160,Generic,Bedroom - Beds
70,Verona Curved 6Sseater,"Make a bold statement with the Verona Curved Sofa, a stunning blend of vintage charm and modern design. Upholstered in a vibrant orange fabric, this eye-catching piece features classic Chesterfield tufting along the curved backrest, adding depth, detail, and timeless elegance.

The gently curved silhouette creates a warm, inviting atmosphere, perfect for stylish living rooms, lounges, or statement office spaces. Plush cushioning and expert craftsmanship ensure both beauty and comfort.",80000.00 KES,null,in stock,new,https://res.cloudinary.com/dtz6b2pip/image/upload/v1750947888/20250609_111858_c1dlo5.jpg,https://bobbyfurniturekenya.com/product/70,Generic,Living Room - Couches in Set
69,Ember Haven Black,"Ember Haven – Black Corduroy Sectional Sofa

Add timeless charm and bold elegance to your space with the Ember Haven sectional sofa. Wrapped in rich black corduroy fabric, this L-shaped masterpiece brings together modern comfort and classic texture. The ribbed corduroy not only looks luxurious but also feels irresistibly soft, creating a cozy seating experience you’ll love.
Designed to anchor your living room, the Ember Haven offers generous space for lounging, hosting, or relaxing with family. Its modular design fits beautifully into both open spaces and corners, while the sleek black finish adds a touch of sophistication to any interior. 
Whether you're entertaining guests or enjoying a quiet evening, the Ember Haven is your perfect comfort zone",58000.00 KES,null,in stock,new,https://res.cloudinary.com/dtz6b2pip/image/upload/v1750947886/20250619_040944_lu0zgw.jpg,https://bobbyfurniturekenya.com/product/69,Generic,Living Room - Sectional Sofas
72,Green Bubble Fabric,"A modern, luxurious 6-seater sofa upholstered in soft green bubble-textured fabric. Built with a sturdy wooden frame and high-density foam for comfort and durability. The rounded, puffed design adds a cozy yet stylish touch to any living room.

Features:

Seats up to 6 people comfortably

Soft, 3D bubble fabric upholstery

Solid wood frame & deep cushions

Modern low-profile design

Easy to clean and long-lasting


Perfect for family spaces or lounges that need both comfort and class.",48000.00 KES,null,in stock,new,https://res.cloudinary.com/dtz6b2pip/image/upload/v1761080167/20251020_133627_vhyp5t.jpg,https://bobbyfurniturekenya.com/product/72,Generic,Living Room - Sofas
23,Carson 5 seater Classic Sofa Set,"Sleek, spacious, and effortlessly stylish — The Carson 5 is designed for modern living with a touch of timeless charm. This 5-seater sofa features clean lines, plush cushions, and wide seating that invites relaxation for the whole family. Upholstered in a soft, durable fabric (or leather, if applicable), it’s built for comfort and made to last.

Its minimalist profile is elevated by gently flared arms and low-profile legs, making it a versatile piece that blends seamlessly into contemporary, urban, or classic spaces. Whether you're hosting guests or enjoying a quiet evening, The Carson 5 offers the perfect balance of comfort, space, and style.

Perfect For:

Family lounges

Contemporary apartments

Guest-ready living rooms

Airbnb or serviced apartments",65000.00 KES,null,in stock,new,https://res.cloudinary.com/dtz6b2pip/image/upload/v1748128575/20250525_020132_mxxip1.jpg,https://bobbyfurniturekenya.com/product/23,Generic,Storage
67,"Nior Diamond Bed 6by6 ","Elevate your bedroom with the unmatched elegance of the Nior Diamond Bed — where bold design meets timeless luxury. Crafted with precision, this bed features a stunning diamond-tufted headboard and footboard, accented with subtle gold trims that add a rich, modern flair. The geometric layout and plush upholstery not only enhance visual appeal but also provide supreme comfort and support",65000.00 KES,null,in stock,new,https://res.cloudinary.com/dtz6b2pip/image/upload/v1748663295/20250531_064721_ewzptn.jpg,https://bobbyfurniturekenya.com/product/67,Generic,Bedroom - Headboards
153,4by6 Jungle Green Lines Vela,"Elevate your bedroom with the Jungle Green Tufted Bed, a perfect blend of modern style and comfort. This bed features a beautifully tufted headboard that adds a touch of sophistication to your space. The light gray upholstery is not only chic but also versatile, allowing it to complement various decor styles, from contemporary to classic. Constructed with high-quality materials, this queen bed ensures durability and stability for a restful night's sleep. The spacious queen size provides ample room for couples or individuals who enjoy extra space while sleeping
Whether you're redecorating your master bedroom or furnishing a guest room, the Light Gray Tufted Queen Bed is an excellent choice that combines functionality with aesthetic appeal. Create a cozy and inviting atmosphere in your bedroom with this stylish bed",28000.00 KES,null,in stock,new,https://res.cloudinary.com/dtz6b2pip/image/upload/v1747963952/20250523_042249_ev7r8b.jpg,https://bobbyfurniturekenya.com/product/153,Generic,Bedroom - Beds
146,5by6 Black Chester Bed,"Transform your bedroom into a luxurious retreat with the Marron Chester Bed, available exclusively at Bed Palace Kenya. This stunning bed is designed with both style and comfort in mind, featuring a beautifully upholstered headboard embellished with intricate button tufting. The spacious king size provides ample room for couples or individuals who appreciate extra space, while the durable construction ensures long-lasting support and stability. Compatible with a variety of mattress types, the Chester Bed promises an unparalleled sleeping experience. Elevate your bedroom decor and enjoy the perfect blend of elegance and functionality with this exquisite piece of furniture.",36000.00 KES,null,in stock,new,https://res.cloudinary.com/dtz6b2pip/image/upload/v1747960756/20250523_033801_ygegkj.jpg,https://bobbyfurniturekenya.com/product/146,Generic,Bedroom - Beds
172,"5by6 Bubble Bed White ","Introduce playful elegance and unmatched comfort into your bedroom with our signature Bubble Bed. Designed with a bold, modern aesthetic, the Bubble Bed features a uniquely tufted headboard and footboard with rounded, ""bubble-like"" curves that add a soft, inviting touch to any space.

Upholstered in premium fabric or velvet of your choice, this bed is a statement piece that balances artistic design with cozy functionality. Its solid wooden frame provides reliable support, while the plush cushioning ensures every moment spent lounging or sleeping feels luxurious.

Key Features:

Distinctive bubble-tufted design for a trendy, standout look

Soft, high-quality velvet or fabric upholstery

Durable hardwood frame for long-lasting performance

Available in multiple colors and sizes

Perfect for modern, chic, or glam bedroom themes
",48000.00 KES,null,in stock,new,https://res.cloudinary.com/dtz6b2pip/image/upload/v1748662436/20250526_041438_yhqbbe.jpg,https://bobbyfurniturekenya.com/product/172,Generic,Bedroom - Beds
212,"6 Seater Modular Bubble Seat Beige ","Experience unmatched comfort and bold modern design with the Bubble  Sofa — a true masterpiece for contemporary living spaces. Designed with deep tufted cushioning and wrapped in plush, premium upholstery, this oversized sectional offers both elegance and relaxation in one stunning package.

Whether you're lounging solo or entertaining guests, its spacious layout and modular design allow for ultimate flexibility and luxurious comfort. Perfect for statement interiors and family-friendly living.

Features:

Ultra-soft, cloud-like deep tufted seating

Premium textured fabric upholstery

Modular design for customizable arrangements

Built for comfort, durability, and visual impact",70000.00 KES,null,in stock,new,https://res.cloudinary.com/dtz6b2pip/image/upload/v1748032369/20250523_233232_o6v0up.jpg,https://bobbyfurniturekenya.com/product/212,Generic,Living Room - Sectional Sofas
236,Mustard Yellow Wing Chairs,"Make a bold statement with our elegant wing chairs — the perfect blend of classic charm and modern comfort. Designed with high backs, graceful “wings,” and plush cushioning, our wing chairs offer both support and style. Whether used as a reading nook accent, a statement piece in your living room, or a cozy corner addition, Bobby Furniture Kenya’s wing chairs bring sophistication and relaxation to any space. Upholstered in premium fabrics and crafted with durable frames, they’re built to offer timeless beauty and lasting comfort.

",62000.00 KES,null,in stock,new,https://res.cloudinary.com/dtz6b2pip/image/upload/v1748040111/20250524_013849_zwgvol.jpg,https://bobbyfurniturekenya.com/product/236,Generic,Living Room - Accent Chairs
66,Saffron Accent Edit Seat,"Elevate your space with The Accent Edit – a bold yet elegant statement chair in a striking saffron hue. Designed for the modern home, this piece combines plush comfort with eye-catching style. Whether placed in a cozy corner or as a standout piece in your living room, it adds warmth, personality, and sophistication.

Premium cushioning for all-day comfort

Upholstered in vibrant, durable saffron fabric

Solid frame for lasting support

Perfect for living rooms, bedrooms, or reading nooks",29000.00 KES,null,in stock,new,https://res.cloudinary.com/dtz6b2pip/image/upload/v1748544292/20250529_070046_rfl3h5.jpg,https://bobbyfurniturekenya.com/product/66,Generic,Living Room - Accent Chairs
242,"Classic Grey Square Coffee Table ","Our coffee tables are more than just furniture — they’re the centerpiece of your living space. At Bobby Furniture Kenya, we design coffee tables that blend style, function, and durability. Whether you're looking for a sleek modern piece, a rustic wooden charm, or a minimalist glass-top design, we have options to suit every taste and space. Perfect for hosting, displaying décor, or simply relaxing with a cup of coffee, our tables add warmth and elegance to any room. Crafted with quality materials and attention to detail, a Bobby coffee table transforms your living room into a stylish, inviting space.
",22000.00 KES,null,in stock,new,https://res.cloudinary.com/dtz6b2pip/image/upload/v1748041222/20250524_015640_ou4nnc.jpg,https://bobbyfurniturekenya.com/product/242,Generic,Living Room - Coffee Tables
244,Marbled kiel black & white,"Our coffee tables are more than just furniture — they’re the centerpiece of your living space. At Bobby Furniture Kenya, we design coffee tables that blend style, function, and durability. Whether you're looking for a sleek modern piece, a rustic wooden charm, or a minimalist glass-top design, we have options to suit every taste and space. Perfect for hosting, displaying décor, or simply relaxing with a cup of coffee, our tables add warmth and elegance to any room. Crafted with quality materials and attention to detail, a Bobby coffee table transforms your living room into a stylish, inviting space.
",28000.00 KES,null,in stock,new,https://res.cloudinary.com/dtz6b2pip/image/upload/v1748041222/20250524_015727_ncq1wv.jpg,https://bobbyfurniturekenya.com/product/244,Generic,Living Room - Coffee Tables
16,"Nyumbani Coffee Table ","Bring charm and functionality to your living space with the Bobby Brew Table — a beautifully handcrafted coffee table designed for modern Kenyan homes. Made from premium mahogany wood with a smooth matte finish, this table blends natural elegance with sturdy craftsmanship. Its low-profile design and wide surface make it perfect for serving drinks, displaying décor, or anchoring your lounge setup. Whether you're sipping coffee or entertaining guests, the Bobby Brew Table delivers timeless style and everyday comfort.

Key Features:

Handcrafted from MDF Board 

Durable, smooth finish with water-resistant coating",22000.00 KES,null,in stock,new,https://res.cloudinary.com/dtz6b2pip/image/upload/v1748123374/20250525_004759_gieryz.jpg,https://bobbyfurniturekenya.com/product/16,Generic,Living Room - Coffee Tables
229,"BobbyLux Classic White ","Bobby Furniture Kenya, our TV stands are crafted to blend functionality with style, bringing elegance and organization to your living room. Designed with modern Kenyan homes in mind, our stands offer ample storage space for your TV, media devices, and decorative items. Whether you prefer sleek contemporary designs, rustic wooden finishes, or bold statement pieces, we have a variety to match your style and space. Each piece is built with quality materials to ensure durability, easy cable management, and a neat entertainment setup. Upgrade your viewing experience with a TV stand that stands out.
",24000.00 KES,null,in stock,new,https://res.cloudinary.com/dtz6b2pip/image/upload/v1748038643/20250524_011503_liaucz.jpg,https://bobbyfurniturekenya.com/product/229,Generic,Living Room - TV Stands
136,Raha Corner Charcoal Grey 6 seater,"Introducing the Six Seater Gray Sectional Couch from Bed Palace Sofas, a perfect blend of style and functionality. This spacious sectional is designed to accommodate family and friends, providing ample seating with its six-seat configuration. The couch features a robust frame made from a blend of kiln- dried solid and engineered wood, ensuring durability and support
Its hand-tied spring construction offers exceptional comfort, while the removable back cushions wrapped in foam provide a plush seating experience
The easy-care polyester upholstery in a neutral gray hue complements any interior decor, making it a versatile addition to your living room. Whether you're hosting a gathering or enjoying a quiet evening, this sectional ensures you do so in style and comfort. Experience the perfect balance of elegance and practicality with this stunning piece of furniture.",58000.00 KES,null,in stock,new,https://res.cloudinary.com/dtz6b2pip/image/upload/v1748033950/20250212_105330_yjfm3j.jpg,https://bobbyfurniturekenya.com/product/136,Generic,Living Room - Sectional Sofas
196,White Luxe 3 Seater,"Bring elegance and comfort into your home with the White Luxe 3-Seater Sofa. Handcrafted for durability and designed for style, this sofa features deep seating, firm yet soft cushions, and a timeless silhouette that fits any modern or traditional living room. The smooth fabric finish is both breathable and easy to maintain, making it perfect for family use or formal spaces.
",32000.00 KES,null,in stock,new,https://res.cloudinary.com/dtz6b2pip/image/upload/v1748025542/20250523_213716_yrcjz5.jpg,https://bobbyfurniturekenya.com/product/196,Generic,Living Room - Sofas
27,Savannah L-shaped Sofa,"Bring the warmth and beauty of the wild indoors with the Savannah L-Shaped Sofa — a bold yet comfortable piece inspired by the vast, open landscapes of Africa. With its earthy tones, soft fabric, and generously cushioned seating, this sectional invites you to sink in and unwind in natural style.

The Savannah features a relaxed L-shaped design, perfect for maximizing space and creating a cozy conversation zone in your living area. Whether you're hosting guests or enjoying a quiet night in, its wide seating and supportive backrests offer all-day comfort.

Built with a strong wooden frame and finished with tailored details, the Savannah is a perfect fusion of rugged charm and contemporary elegance.

Key Features:

L-shaped for space efficiency

Earth-toned color palette

Deep seats and plush cushions

Durable, easy-to-maintain fabric

Strong hardwood structure


Perfect For:

Nature-inspired interiors

Modern African homes

Eco-chic Airbnbs

Stylish family living rooms",62000.00 KES,null,in stock,new,https://res.cloudinary.com/dtz6b2pip/image/upload/v1748128020/20250525_015915_fytvko.jpg,https://bobbyfurniturekenya.com/product/27,Generic,Living Room - Sectional Sofas
52,Aviana U-shaped pink orange,"The Aviana U-Shaped Sofa is the ultimate centerpiece for modern living, blending refined elegance with luxurious comfort. Designed for large spaces and family gatherings, Aviana offers ample seating, deep cushioning, and a beautifully curved silhouette that invites you to relax in style.

Key Features:

Design: Generous U-shaped layout perfect for spacious living rooms

Seating Capacity: Accommodates 6–8 people comfortably

Style: Soft, contemporary curves with a clean, elegant profile

Upholstery Options: Available in premium fabric or velvet, with custom colors to match your space

Comfort: Plush high-density cushions and wide armrests for maximum relaxation

Frame: Sturdy hardwood frame built for lasting durability

Extras (Optional): Throw pillows, matching ottoman, or storage features available

Ideal For: Large families, entertainers, or anyone who loves bold, beautiful furniture
",75000.00 KES,null,in stock,new,https://res.cloudinary.com/dtz6b2pip/image/upload/v1748306455/20250526_063342_bt9ddt.jpg,https://bobbyfurniturekenya.com/product/52,Generic,Living Room - Sectional Sofas
41,The Grandwood Classic 6-Seater,"Bring timeless elegance and lasting durability to your dining space with our 6-seater solid mahogany dining table. Expertly handcrafted from premium mahogany wood, this table showcases rich, deep tones and a fine natural grain that adds warmth and sophistication to any interior.

Designed to comfortably seat six, it features a spacious tabletop perfect for everyday meals or special gatherings. The solid wood construction ensures strength and longevity, while the smooth, polished finish highlights the wood’s natural beauty and offers protection against everyday wear.

Whether styled in a classic or modern home, this mahogany dining table is more than furniture—it’s a statement of refined taste and craftsmanship.",95000.00 KES,null,in stock,new,https://res.cloudinary.com/dtz6b2pip/image/upload/v1748294014/20250526_050720_bnocbw.jpg,https://bobbyfurniturekenya.com/product/41,Generic,Dining Room - Six Seater Dining Sets
50,"Lorenzia 8-Seater Dinning Table ","Make a statement in your dining area with this striking 8-seater dining set, designed with a robust metal frame and sleek curved iron chairs. Blending industrial style with modern comfort, this set is ideal for both spacious homes and stylish commercial settings.

Key Features:

Seating Capacity: Accommodates 8 people comfortably

Material: Full metal construction with solid iron for durability and stability

Tabletop: Available in wood, glass, or metal finishes for a customized look

Chairs: Ergonomically curved iron chairs that offer both support and modern flair

Finish Options: Matte black, rustic bronze, or custom powder-coated colors

Design Style: Industrial-modern with clean lines and bold presence

Ideal For: Large dining rooms, open-plan living spaces, restaurants, or outdoor patios

Durability: Weather-resistant options available; rust-protected and easy to clean",110000.00 KES,null,in stock,new,https://res.cloudinary.com/dtz6b2pip/image/upload/v1748305462/20250527_032406_aiqsdr.jpg,https://bobbyfurniturekenya.com/product/50,Generic,Dining Room - Eight Seater Dining Sets
65,"Zara Z Dining Table ","Elevate your dining experience with the Zara Z Dining Table, a masterpiece of modern design and timeless craftsmanship. Built from premium solid mahogany wood, this 6-seater table brings both luxury and durability to your home.

Its signature Z-shaped legs add a bold, contemporary flair, while the rich, natural wood finish makes every meal feel special. Whether you're hosting a dinner party or enjoying a quiet family meal, the Zara Z Dining Set offers unmatched comfort and style.

Key Features:

Solid mahogany wood construction for lasting strength

Stylish Z-shaped legs with a modern aesthetic

Seats 6 comfortably",110000.00 KES,null,in stock,new,https://res.cloudinary.com/dtz6b2pip/image/upload/v1748420254/20250528_020145_fugg91.jpg,https://bobbyfurniturekenya.com/product/65,Generic,Dining Room - Six Seater Dining Sets
25,"Beige 5-Seater Chester ","Add timeless elegance and luxurious comfort to your living space with our Beige 5-Seater Chesterfield Sofa. Expertly crafted with a classic tufted backrest, rolled arms, and deep seating, this piece is perfect for both modern and traditional interiors. The soft beige upholstery adds a warm, neutral touch that blends seamlessly with any décor, while the sturdy hardwood frame ensures long-lasting durability.

Key Features:

Classic Chesterfield design with deep button tufting

Soft, durable beige fabric upholstery

Spacious 5-seater layout ideal for families and entertaining

Rolled arms and plush cushions for maximum comfort

Strong hardwood frame and quality craftsmanship",55000.00 KES,null,in stock,new,https://res.cloudinary.com/dtz6b2pip/image/upload/v1748128022/20250525_020201_i4nxl2.jpg,https://bobbyfurniturekenya.com/product/25,Generic,Living Room - Couches in Set
