id,title,description,price,sale_price,availability,condition,image_link,link,brand,google_product_category
107,"Steel Console Table With Marble Top ","The Console Table with a Marble Top is a stunning addition to any home, combining elegance with functionality. Crafted with a durable frame, this table features a luxurious marble top that adds a touch of sophistication to your space. Ideal for entryways, living rooms, or hallways, it provides a stylish surface for displaying decor, holding keys, or showcasing your favorite books.
The table is available in multiple sizes to suit your needs, ensuring it fits perfectly in your desired location. Additionally, you can choose from a variety of colors for the base, allowing you to customize the look to match your interior design. Whether you prefer a classic white marble or a bold colored base, this console table is designed to enhance your home's aesthetic while providing practical use.",43000.00 KES,null,out of stock,new,https://res.cloudinary.com/dtz6b2pip/image/upload/v1743290765/1743290724659_ijs5y5.png,https://bobbyfurniturekenya.com/product/107,Generic,Living Room - Console Tables
278,NOVA Kids Bunk Bed with Storage,"The NOVA Kids Bunk Bed is a smart, space-saving solution designed for modern family homes. It features an upper bunk, two lower pull-out beds, integrated side ladder, and a drawer storage unit, making it ideal for shared bedrooms while keeping the room organized and clutter-free.",185000.00 KES,null,in stock,new,https://res.cloudinary.com/dtz6b2pip/image/upload/v1769005507/20250827_033958_ijmyk9.jpg,https://bobbyfurniturekenya.com/product/278,Generic,Kids Room - Double Deckers
128,Modern Ceramic Vase,"Modern Ceramic Vase Fish Tall Design In Matte Black & White, Handcrafted with Snow Powder Mountain Patterns for Home Decor
Available in white and black",3500.00 KES,null,in stock,new,https://res.cloudinary.com/dtz6b2pip/image/upload/v1743541933/1743541703977_yaxmmh.png,https://bobbyfurniturekenya.com/product/128,Generic,Decor
89,"Preston Beige 5by6 Bed With 2 Nightstand ","The Grey Wooden Bed (5x6) is a beautifully crafted piece of furniture that combines elegance and comfort. Made from high-quality wood, this bed offers both durability and a timeless design that complements any bedroom decor. The spacious queen size ensures ample sleeping space, making it ideal for couples or individuals who enjoy extra room. With its sturdy construction and aesthetically pleasing wooden finish, this bed not only enhances your sleeping experience but also adds a touch of sophistication to your room.",52000.00 KES,null,in stock,new,https://res.cloudinary.com/dtz6b2pip/image/upload/v1748017718/20250523_192519_lvnrjx.jpg,https://bobbyfurniturekenya.com/product/89,Generic,Bedroom - Beds
93,"Chest Of Drawers ","Enhance your bedroom or living space with this stunning chest of drawers featuring a sleek marble top. Crafted for both style and practicality, this piece offers ample storage while adding a touch of luxury to your home. The chest of drawers is fully customizable to any color, ensuring it complements your décor perfectly. Ideal for storing clothes, accessories, or other essentials, this versatile piece offers a perfect balance of form and function. The durable marble top elevates its elegance, making it a timeless addition to any modern home.",35000.00 KES,null,in stock,new,https://res.cloudinary.com/dtz6b2pip/image/upload/v1743212407/1743212338937_jz0jpc.png,https://bobbyfurniturekenya.com/product/93,Generic,Bedroom - Wardrobes
97,5 feet Tv Stand T001,"The Tv Stand is designed to be both functional and stylish ponding enough space for your door and sound
you to showcase your decorative plants, or books
One of the standout features of this stand table color options enabling you to select a fish that perfectly complements your home decor Whether you prefer a sleek back a warm wood tone or a bright pop of color this stand can be tailored to match your aesthetic
Crafted from high-quality materials, the TV Stand ensures durability and stability making entemente
in your wing mom
areable choice for you
design not only enhances your viewing experience but also serves as a stylish focal po
Whether you're hosting a movie night or enjoying
cozy and miting atmosphere in your home
evening the TV Stand is the perfect addition to create a",25000.00 KES,null,in stock,new,https://res.cloudinary.com/dtz6b2pip/image/upload/v1743285976/1743285878781_pbdsfq.png,https://bobbyfurniturekenya.com/product/97,Generic,Living Room - TV Stands
96,Buffet Table in any type of colour,"Serve your guests in style with our elegant buffet table, perfect for dining and entertaining. This versatile piece offers ample storage space for dishes, cutlery, and linens, making it ideal for hosting gatherings or family meals. Crafted with a beautiful finish, it complements various decor styles while providing functionality. Its spacious surface is perfect for displaying food and drinks, ensuring that your entertaining setup is both practical and stylish. Elevate your dining experience with this must-have buffet table",28999.00 KES,null,in stock,new,https://res.cloudinary.com/dtz6b2pip/image/upload/v1743285315/1743285186102_gjsyas.png,https://bobbyfurniturekenya.com/product/96,Generic,Living Room - Console Tables
98,TV Stand T002,"Enhance your entertainment area with our contemporary TV stand designed for both style and functionality. The middle space is perfect for housing your soundbar while providing additional storage for media devices, books, or decorative items. Built with sturdy metallic support legs, this stand offers stability and a sleek look. Its curvy edges add a touch of elegance, making it a stylish addition to any living room. Whether you're watching your favorite shows or hosting movie nights, this TV stand is the perfect blend of practicality and modern design.",27999.00 KES,null,in stock,new,https://res.cloudinary.com/dtz6b2pip/image/upload/v1743286745/1743286505359_qjovio.png,https://bobbyfurniturekenya.com/product/98,Generic,Living Room - TV Stands
106,Steel Console Table With Marble Top,"The Console Table with a Marble Top is a stunning addition to any home, combining elegance with functionality. Crafted with a durable frame, this table features a luxurious marble top that adds a touch of sophistication to your space. Ideal for entryways, living rooms, or hallways, it provides a stylish surface for displaying decor, holding keys, or showcasing your favorite books.
The table is available in multiple sizes to suit your needs, ensuring it fits perfectly in your desired location. Additionally, you can choose from a variety of colors for the base, allowing you to customize the look to match your interior design. Whether you prefer a classic white marble or a bold colored base, this console table is designed to enhance your home's aesthetic while providing practical use.",34999.00 KES,null,in stock,new,https://res.cloudinary.com/dtz6b2pip/image/upload/v1743290765/1743290636246_ikuddn.png,https://bobbyfurniturekenya.com/product/106,Generic,Living Room - Console Tables
138,"Athens 3 Seater Chester ","Upgrade your living space with our stylish and spacious 3-seater sofa — the perfect blend of comfort and class. Expertly crafted with a sturdy hardwood frame and plush, high-density cushions, this sofa offers lasting durability and support. Wrapped in premium upholstery, it's soft to the touch and easy to clean, making it ideal for both everyday lounging and entertaining guests. The sleek design and neutral tones fit effortlessly into any décor.

Features:

Seats 3 adults comfortably

High-resilience foam cushions

Premium fabric/leather finish (customizable)

Strong wooden frame for long-term durability

Modern design with elegant stitching

Perfect for your home, office, or lounge space.",30000.00 KES,null,in stock,new,https://res.cloudinary.com/dtz6b2pip/image/upload/v1748019248/155124990de86c00d80e83916e95376c_blvrjp.jpg,https://bobbyfurniturekenya.com/product/138,Generic,Living Room - Sofas
265,5FT Modern Black Slatted TV Stand,"A sleek and modern 5-foot TV stand crafted with a bold black finish and stylish slatted side panels. Designed with open shelves for consoles, decoders, or décor items, this stand blends premium aesthetics with functional storage. Its sturdy construction and minimalist luxury appeal make it perfect for contemporary living rooms, apartments, and entertainment areas.",28000.00 KES,null,in stock,new,https://res.cloudinary.com/dtz6b2pip/image/upload/v1769005809/20250827_015040_abrr1l.jpg,https://bobbyfurniturekenya.com/product/265,Generic,Living Room - TV Stands
262,6-Seater Deep Comfort Sectional Sofa with Ottoman,"A luxurious deep-seating sectional sofa designed for maximum comfort and modern elegance. This 6-seater features oversized plush cushions, a wide chaise for lounging, and a matching ottoman for added relaxation. Upholstered in premium velvet-touch fabric, this sofa delivers both comfort and style, making it perfect for contemporary living rooms. Strong hardwood framing and high-density foam ensure long-lasting durability and support.",48000.00 KES,null,in stock,new,https://res.cloudinary.com/dtz6b2pip/image/upload/v1769005847/20250827_014746_yrsvkz.jpg,https://bobbyfurniturekenya.com/product/262,Generic,Living Room - Sectional Sofas
266,6-Seater Premium Tufted Sectional Sofa,"A spacious 6-seater tufted sectional designed for ultimate comfort and contemporary elegance. Built with extra-wide seats, deep cushioning, and premium fabric, this sofa delivers exceptional relaxation while adding a luxurious modern touch to your living space. Perfect for family lounges and large living rooms, crafted with a strong hardwood frame and high-density cushions for long-lasting durability.",46500.00 KES,null,in stock,new,https://res.cloudinary.com/dtz6b2pip/image/upload/v1769005797/20250827_015215_v6vc2l.jpg,https://bobbyfurniturekenya.com/product/266,Generic,Living Room - Sectional Sofas
269,U-Shaped Sectional Sofa – Premium Fabric with Spring Cushions,"This is a large U-shaped sectional sofa designed for maximum comfort and family seating. Upholstered in high-quality premium fabric, it features spring-supported seat cushions (not bubble foam), providing excellent durability, firm support, and long-lasting comfort. Ideal for spacious living rooms, lounges, and modern homes.",105000.00 KES,null,in stock,new,https://res.cloudinary.com/dtz6b2pip/image/upload/v1769005744/20250827_015415_zhbb9y.jpg,https://bobbyfurniturekenya.com/product/269,Generic,Living Room - Sectional Sofas
276,ORION Square Coffee Table With Brown Details,"The ORION Square Coffee Table features a bold, clean-lined square design that delivers balance and modern elegance. Built with a solid structure and subtle accent detailing, it is ideal for pairing with sectional and L-shaped sofas, offering both visual impact and everyday functionality.",25500.00 KES,null,in stock,new,https://res.cloudinary.com/dtz6b2pip/image/upload/v1769005536/20250827_033757_ydb0ao.jpg,https://bobbyfurniturekenya.com/product/276,Generic,Living Room - Coffee Tables
73,5by6 Maroon Chester Bed,"Transform your bedroom into a luxurious retreat with the Marron Chester Bed, available exclusively at Bed Palace Kenya. This stunning bed is designed with both style and comfort in mind, featuring a beautifully upholstered headboard embellished with intricate button tufting. The spacious king size provides ample room for couples or individuals who appreciate extra space, while the durable construction ensures long-lasting support and stability. Compatible with a variety of mattress types, the Chester Bed promises an unparalleled sleeping experience. Elevate your bedroom decor and enjoy the perfect blend of elegance and functionality with this exquisite piece of furniture.",36000.00 KES,null,in stock,new,https://res.cloudinary.com/dtz6b2pip/image/upload/v1747960756/20250523_033734_q6jd4o.jpg,https://bobbyfurniturekenya.com/product/73,Generic,Bedroom - Beds
90,5by6 White wooden bed,"The White Wooden Bed (5x6) is a beautifully crafted piece of furniture that combines elegance and comfort. Made from high-quality wood, this bed offers both durability and a timeless design that complements any bedroom decor The spacious queen size ensures ample sleeping space, making it ideal for couples or individuals who enjoy extra room. With its sturdy construction and aesthetically pleasing wooden finish, this bed not only enhances your sleeping experience but also adds a touch of sophistication to your room.",38000.00 KES,null,in stock,new,https://res.cloudinary.com/dtz6b2pip/image/upload/v1748018043/20250523_193253_incc2z.jpg,https://bobbyfurniturekenya.com/product/90,Generic,Bedroom - Beds
247,6-Seater Rectangle Dining Table Set,"This 6-seater hardwood dining table set combines strength, elegance, and everyday comfort. The polished rectangular tabletop showcases a rich natural wood grain, supported by beautifully carved hardwood legs for stability and style. The set includes six cushioned dining chairs featuring solid wooden frames and soft textured upholstery, offering comfortable seating for family meals or guests. Perfect for homes, restaurants, and modern dining spaces, this set delivers durability, beauty, and timeless craftsmanship.",85000.00 KES,null,in stock,new,https://res.cloudinary.com/dtz6b2pip/image/upload/v1768983535/lv_0_20251217144900_rkh5p9.jpg,https://bobbyfurniturekenya.com/product/247,Generic,Dining Room - Six Seater Dining Sets
85,5by6 Light Grey Lines Vela,"Elevate your bedroom with the Light Gray Tufted Queen Bed, a perfect blend of modern style and comfort. This bed features a beautifully tufted headboard that adds a touch of sophistication to your space. The light gray upholstery is not only chic but also versatile, allowing it to complement various decor styles, from contemporary to classic. Constructed with high-quality materials, this queen bed ensures durability and stability for a restful night's sleep. The spacious queen size provides ample room for couples or individuals who enjoy extra space while sleeping
Whether you're redecorating your master bedroom or furnishing a guest room, the Light Gray Tufted Queen Bed is an excellent choice that combines functionality with aesthetic appeal. Create a cozy and inviting atmosphere in your bedroom with this stylish bed",36000.00 KES,null,in stock,new,https://res.cloudinary.com/dtz6b2pip/image/upload/v1747961801/20250523_035446_ve0e9k.jpg,https://bobbyfurniturekenya.com/product/85,Generic,Bedroom - Beds
83,5by6 Throne Bed,"The Throne Bed showcases a unique flower-like shaped headboard, adding a touch of femininity and sophistication to any bedroom. With options for upholstery in luxurious fabrics like velvet, this bed combines comfort with style. Available in a variety of colors, it caters to diverse decor preferences making it an ideal centerpiece for both girls' and ladies' rooms.",40000.00 KES,null,in stock,new,https://res.cloudinary.com/dtz6b2pip/image/upload/v1747968124/20250523_053549_omk3lh.jpg,https://bobbyfurniturekenya.com/product/83,Generic,Bedroom - Beds
254,Mustard Yellow Curved Modern Sofa,"This Mustard Yellow Curved Modern Sofa is designed to stand out with its smooth rounded edges, sculpted silhouette, and luxurious soft fabric. Built for both comfort and style, it features deep cushioning and a contemporary curved shape that fits perfectly in modern living rooms, studios, lounges, or Airbnb spaces. The plush mustard upholstery adds warmth and elegance, while the ergonomic backrest and arm design deliver exceptional comfort for everyday relaxation.

",42000.00 KES,null,in stock,new,https://res.cloudinary.com/dtz6b2pip/image/upload/v1768990278/20260121_104020_hjs2ll.jpg,https://bobbyfurniturekenya.com/product/254,Generic,Living Room - Sofas
243,Black & White Square Coffee Table With Glass,"Our coffee tables are more than just furniture — they’re the centerpiece of your living space. At Bobby Furniture Kenya, we design coffee tables that blend style, function, and durability. Whether you're looking for a sleek modern piece, a rustic wooden charm, or a minimalist glass-top design, we have options to suit every taste and space. Perfect for hosting, displaying décor, or simply relaxing with a cup of coffee, our tables add warmth and elegance to any room. Crafted with quality materials and attention to detail, a Bobby coffee table transforms your living room into a stylish, inviting space.
",22000.00 KES,null,in stock,new,https://res.cloudinary.com/dtz6b2pip/image/upload/v1748041222/20250524_015657_iirzew.jpg,https://bobbyfurniturekenya.com/product/243,Generic,Living Room - Coffee Tables
259,5ft Modern TV Stand with Built-In Electric Fireplace,"Transform your living room with this 5ft Modern TV Stand featuring a built-in electric fireplace. Designed with a clean white matte finish, this unit adds both elegance and warmth to your entertainment space. The fireplace insert produces a realistic glowing ember effect, creating a cozy ambience without smoke or heat. Built with strong hardwood and a smooth finish, the stand supports your TV while adding a luxurious, contemporary touch to your home. Perfect for modern interiors looking for style and functionality in one piece.",38000.00 KES,null,in stock,new,https://res.cloudinary.com/dtz6b2pip/image/upload/v1769005884/20250826_032705_cecbpm.jpg,https://bobbyfurniturekenya.com/product/259,Generic,Living Room - TV Stands
277,LUNA Round Coffee Table,"The LUNA Round Coffee Table features a smooth circular top with a sturdy geometric base, delivering a modern yet timeless look. Its rounded design softens living spaces and pairs perfectly with sectional, L-shaped, and U-shaped sofas.",20000.00 KES,null,in stock,new,https://res.cloudinary.com/dtz6b2pip/image/upload/v1769005521/20250827_033853_ssdmdc.jpg,https://bobbyfurniturekenya.com/product/277,Generic,Living Room - Coffee Tables
111,Double Decker DD001,"The Double Decker (4by6) bed is a practical and stylish solution for maximizing sleeping space in your home Designed to accommodate two individuals comfortably, this bunk bed is perfect for children's rooms, guest accommodations, or shared living spaces. Its sturdy construction ensures safety and durability, while the classic design complements various interior styles. Whether you need extra sleeping arrangements for guests or a fun sleeping solution for kids, the double decker bed provides both functionality and comfort",35000.00 KES,null,in stock,new,https://res.cloudinary.com/dtz6b2pip/image/upload/v1743526332/1743526181795_qlr9fw.png,https://bobbyfurniturekenya.com/product/111,Generic,Kids Room - Double Deckers
112,Double Decker DD002,"
The Double Decker (4x6) bed is a practical and stylish solution for maximizing sleeping space in your home Designed to accommodate two individuals comfortably, this bunk bed is perfect for children's rooms, guest accommodations, or shared living spaces. Its sturdy construction ensures safety and durability, while the classic design complements various interior styles. Whether you need extra sleeping arrangements for guests or a fun sleeping solution for kids, the double decker bed provides both functionality and comfort",38000.00 KES,null,in stock,new,https://res.cloudinary.com/dtz6b2pip/image/upload/v1743527273/1743527227911_amzfxu.png,https://bobbyfurniturekenya.com/product/112,Generic,Kids Room - Double Deckers
113,"Double Decker Single sized(4by6) With Storage ","
The Double Decker Single Sized (4x6) Bed with Storage is the perfect solution for maximizing space without compromising on style or functionality. This innovative design features two single-sized beds stacked vertically making it an excellent choice for shared rooms or smaller spaces. The integrated storage options, such as drawers or shelves, provide additional space for toys, clothes, or bedding, keeping rooms organized and clutter free. Crafted from durable materials, this bed ensures a safe and comfortable sleeping environment for kids and guests alike",50000.00 KES,null,in stock,new,https://res.cloudinary.com/dtz6b2pip/image/upload/v1743529025/1743528976472_brnn1d.png,https://bobbyfurniturekenya.com/product/113,Generic,Kids Room - Double Deckers
99,TV Stand T003,"The TV Stand is designed to be both functional and stylish, providing enough space for your decor and sound system. With a spacious surface area, it accommodates televisions and additional media devices while allowing you to showcase your favorite decorative items, plants, or books.

One of the standout features of this TV stand is its customizable color options, enabling you to select a finish that perfectly complements your home decor. Whether you prefer a sleek black, a warm wood tone, or a bright pop of color, this stand can be tailored to match your aesthetic.

Crafted from high-quality materials, the TV Stand ensures durability and stability, making it a reliable choice for your entertainment needs. Its design not only enhances your viewing experience but also serves as a stylish focal point in your living room.

Whether you're hosting a movie night or enjoying a quiet evening, the TV Stand is the perfect addition to create a cozy and inviting atmosphere in your home.",28000.00 KES,null,in stock,new,https://res.cloudinary.com/dtz6b2pip/image/upload/v1743286744/1743286602353_faedto.png,https://bobbyfurniturekenya.com/product/99,Generic,Living Room - TV Stands
100,TV Stand T004," It accommodates televisions and additional media devices while allowing you to showcase your favorite decorative items, plants, or books.
One of the standout features of this TV stand is its customizable color options, enabling you to select a finish that perfectly complements your home decor. Whether you prefer a sleek black, a warm wood tone, or a bright pop of color, this stand can be tailored to match your aesthetic.
Crafted from high-quality materials, the TV Stand ensures durability and stability, making it a reliable choice for your entertainment needs. Its design not only enhances your viewing experience but also serves as a stylish focal point in your living room.
Whether you're hosting a movie night or enjoying a quiet evening, the TV Stand is the perfect addition to create a cozy and inviting atmosphere in your home.",28500.00 KES,null,in stock,new,https://res.cloudinary.com/dtz6b2pip/image/upload/v1743286745/1743286541128_aq2joz.png,https://bobbyfurniturekenya.com/product/100,Generic,Living Room - TV Stands
101,TV Stand T005,"The TV Stand is designed to be both functional and stylish, providing enough space for your decor and sound system. With a spacious surface area, it accommodates televisions and additional media devices while allowing you to showcase your favorite decorative items, plants, or books.
One of the standout features of this TV stand is its customizable color options, enabling you to select a finish that perfectly complements your home decor. Whether you prefer a sleek black, a warm wood tone, or a bright pop of color, this stand can be tailored to match your aesthetic.
Crafted from high-quality materials, the TV Stand ensures durability and stability, making it a reliable choice for your entertainment needs. Its design not only enhances your viewing experience but also serves as a stylish focal point in your living room.
Whether you're hosting a movie night or enjoying a quiet evening, the TV Stand is the perfect addition to create a cozy and inviting atmosphere in your home.",29000.00 KES,null,in stock,new,https://res.cloudinary.com/dtz6b2pip/image/upload/v1743287725/1743287639175_mgpw3t.png,https://bobbyfurniturekenya.com/product/101,Generic,Living Room - TV Stands
118,Shoe Tree Tower Rack(Rotating),"
Shoe rack for the whole family, Clean your shoes and make your home a more tidy home without discarded shoes at home, The large-capacity shoe rack, put on any pair of your favorite shoes, Give them a small house, Enough to reflect your full love for any pair of shoes.. With a 360-degree rotating design, you can fit up to 24 pairs of shoes or bags in a compact space, No more messy and cluttered closets.. he sleek and modern design of our shoe cabinet will complement any home decor, adding a touch",35000.00 KES,null,in stock,new,https://res.cloudinary.com/dtz6b2pip/image/upload/v1743536403/1743536226150_n9k7jv.png,https://bobbyfurniturekenya.com/product/118,Generic,Storage - Shoe Racks
119,Shoe Rack SH001,"The Shoe Rack with Drawers and Top Platform is an innovative storage solution designed to keep your organized while adding a touch of elegance to your space. This shoe rack features multiple drawers at the bottom, providing convenient storage for accessories, shoe care products, or other small items, ensuring that everything you need is within reach.
The top platform of the shoe rack serves as a perfect spot for placing bags, decorative items, or even a small plant, making it a multifunctional piece that enhances your entryway or closet. Its sleek design allows it to blend seamlessly with various decor styles, from modern to traditional
Constructed from durable materials, this shoe rack is built to withstand daily use while keeping your shoes neatly arranged. The open design promotes airflow, helping to keep your shoes fresh and in good condition. With enough space to accommodate a variety of shoe types, this rack is perfect for families or anyone with a growing shoe collection.
Whether you're looking to declutter your entryway or simply need a stylish way to store your shoes, the Shoe Rack with Drawers and Top Platform is the ideal choice for combining practicality with aesthetic appeal.",22000.00 KES,null,in stock,new,https://res.cloudinary.com/dtz6b2pip/image/upload/v1743536406/1743536291211_ejptgu.png,https://bobbyfurniturekenya.com/product/119,Generic,Storage - Shoe Racks
