id,title,description,price,sale_price,availability,condition,image_link,link,brand,google_product_category
218,"Zenko L.Shape 6 Seater ","Zenko L-shaped coach is a modern and versatile centerpiece crafted to maximize space and comfort. Its angular design fits seamlessly into corners, creating an open and inviting layout ideal for both intimate settings and larger gatherings. With extended lounging space and a cohesive structure, it offers a perfect blend of form and function. The clean lines, supportive cushions, and elegant upholstery make it a stylish addition to any contemporary living area, enhancing both comfort and visual appeal.

",60000.00 KES,null,in stock,new,https://res.cloudinary.com/dtz6b2pip/image/upload/v1748034263/20250524_000344_cwg3lj.jpg,https://bobbyfurniturekenya.com/product/218,Generic,Living Room - Sectional Sofas
228,"Minimal Dinning Table 6 Seater ","Minimal dining table is a strong, classic table made from solid wood like oak or pine. It usually has a smooth, flat top where people eat and strong legs to support it. The wood can be light or dark, showing natural patterns. It comes in different shapes like round or rectangular and fits 4 to 10 people. This type of table adds a warm, natural feel to any dining room.",68000.00 KES,null,in stock,new,https://res.cloudinary.com/dtz6b2pip/image/upload/v1748036624/20250524_004015_p6spnq.jpg,https://bobbyfurniturekenya.com/product/228,Generic,Dining Room - Six seater DIning Sets
227,"Marbled Bobby Luxe 8 Seater Dinning Table ","Bobby Lex dining table is a strong, classic table made from solid wood like oak or pine & Solid iron. It usually has a smooth, flat top where people eat and strong legs to support it. The wood can be light or dark, showing natural patterns. It comes in different shapes like round or rectangular and fits 4 to 10 people. This type of table adds a warm, natural feel to any dining room.",98000.00 KES,null,in stock,new,https://res.cloudinary.com/dtz6b2pip/image/upload/v1748036713/20250524_004237_ublawx.jpg,https://bobbyfurniturekenya.com/product/227,Generic,Dining Room - Eight seater DIning Sets
226,"Bobby Feast Dinning Table 6 Seater ","A wooden dining table is a strong, classic table made from solid wood like oak or pine. It usually has a smooth, flat top where people eat and strong legs to support it. The wood can be light or dark, showing natural patterns. It comes in different shapes like round or rectangular and fits 4 to 10 people. This type of table adds a warm, natural feel to any dining room.

",68000.00 KES,null,in stock,new,https://res.cloudinary.com/dtz6b2pip/image/upload/v1748036627/20250524_004208_n61pgf.jpg,https://bobbyfurniturekenya.com/product/226,Generic,Dining Room - Six seater DIning Sets
224,"Bobby Umoja 6 Seater ","A wooden dining table is a strong, classic table made from solid wood like oak or pine. It usually has a smooth, flat top where people eat and strong legs to support it. The wood can be light or dark, showing natural patterns. It comes in different shapes like round or rectangular and fits 4 to 10 people. This type of table adds a warm, natural feel to any dining room.

",58000.00 KES,null,in stock,new,https://res.cloudinary.com/dtz6b2pip/image/upload/v1748036624/20250524_004057_yzt0wn.jpg,https://bobbyfurniturekenya.com/product/224,Generic,Dining Room - Six seater DIning Sets
225,"6 Seater Dinning Table ","A wooden dining table is a strong, classic table made from solid wood like oak or pine. It usually has a smooth, flat top where people eat and strong legs to support it. The wood can be light or dark, showing natural patterns. It comes in different shapes like round or rectangular and fits 4 to 10 people. This type of table adds a warm, natural feel to any dining room.

",58000.00 KES,null,in stock,new,https://res.cloudinary.com/dtz6b2pip/image/upload/v1748036713/20250524_004050_jkcy5b.jpg,https://bobbyfurniturekenya.com/product/225,Generic,Dining Room - Six seater DIning Sets
216,"Beige Raha Corner 6 Seater ","Raha Corner L-shaped coach is a modern and versatile centerpiece crafted to maximize space and comfort. Its angular design fits seamlessly into corners, creating an open and inviting layout ideal for both intimate settings and larger gatherings. With extended lounging space and a cohesive structure, it offers a perfect blend of form and function. The clean lines, supportive cushions, and elegant upholstery make it a stylish addition to any contemporary living area, enhancing both comfort and visual appeal.

",45000.00 KES,null,in stock,new,https://res.cloudinary.com/dtz6b2pip/image/upload/v1748033470/20250523_235030_t4zex5.jpg,https://bobbyfurniturekenya.com/product/216,Generic,Living Room - Sectional Sofas
217,"Blue Bubble Fabric 6 Seater ","A 6-seater L-shaped coach is a modern and versatile centerpiece crafted to maximize space and comfort. Its angular design fits seamlessly into corners, creating an open and inviting layout ideal for both intimate settings and larger gatherings. With extended lounging space and a cohesive structure, it offers a perfect blend of form and function. The clean lines, supportive cushions, and elegant upholstery make it a stylish addition to any contemporary living area, enhancing both comfort and visual appeal.

",48000.00 KES,null,in stock,new,https://res.cloudinary.com/dtz6b2pip/image/upload/v1748034264/20250524_000359_pek5sn.jpg,https://bobbyfurniturekenya.com/product/217,Generic,Living Room - Sectional Sofas
230,ClassicHue Tv Stand,"Bobby Furniture Kenya, our TV stands are crafted to blend functionality with style, bringing elegance and organization to your living room. Designed with modern Kenyan homes in mind, our stands offer ample storage space for your TV, media devices, and decorative items. Whether you prefer sleek contemporary designs, rustic wooden finishes, or bold statement pieces, we have a variety to match your style and space. Each piece is built with quality materials to ensure durability, easy cable management, and a neat entertainment setup. Upgrade your viewing experience with a TV stand that stands out.
",28000.00 KES,null,in stock,new,https://res.cloudinary.com/dtz6b2pip/image/upload/v1748038642/20250524_011506_p9gjxo.jpg,https://bobbyfurniturekenya.com/product/230,Generic,Living Room - TV Stands
234,Dublin Stand 6 feet long,"At Bobby Furniture Kenya, our TV stands are crafted to blend functionality with style, bringing elegance and organization to your living room. Designed with modern Kenyan homes in mind, our stands offer ample storage space for your TV, media devices, and decorative items. Whether you prefer sleek contemporary designs, rustic wooden finishes, or bold statement pieces, we have a variety to match your style and space. Each piece is built with quality materials to ensure durability, easy cable management, and a neat entertainment setup. Upgrade your viewing experience with a TV stand that stands out.
",25000.00 KES,null,in stock,new,https://res.cloudinary.com/dtz6b2pip/image/upload/v1748040113/20250524_014036_xlqafy.jpg,https://bobbyfurniturekenya.com/product/234,Generic,Living Room - TV Stands
232,White Dressing Mirror with lights,"A dressing mirror is a full-length or medium-sized mirror designed to help individuals view themselves while getting dressed or grooming. It is typically placed in bedrooms, dressing rooms, or closets.

Here are key features of a dressing mirror:

Full-body view: Most dressing mirrors are tall enough to reflect the entire body, making them ideal for checking outfits from head to toe.

Frame styles: They come in a variety of frames—wooden, metal, plastic, or frameless—to match different interior decor themes.

Mounting options: Dressing mirrors can be wall-mounted, free-standing with a stand or easel back, or integrated into a wardrobe or vanity unit.

Added features: Some may include storage compartments, LED lighting, or tilting functions for better angle adjustment.
",45000.00 KES,null,in stock,new,https://res.cloudinary.com/dtz6b2pip/image/upload/v1748039522/20250524_012809_yxakum.jpg,https://bobbyfurniturekenya.com/product/232,Generic,Bedroom - Dressers
237,"Yellow Wing Chair ","Make a bold statement with our elegant wing chairs — the perfect blend of classic charm and modern comfort. Designed with high backs, graceful “wings,” and plush cushioning, our wing chairs offer both support and style. Whether used as a reading nook accent, a statement piece in your living room, or a cozy corner addition, Bobby Furniture Kenya’s wing chairs bring sophistication and relaxation to any space. Upholstered in premium fabrics and crafted with durable frames, they’re built to offer timeless beauty and lasting comfort.

",28000.00 KES,null,in stock,new,https://res.cloudinary.com/dtz6b2pip/image/upload/v1748040111/20250524_013844_gvhbs1.jpg,https://bobbyfurniturekenya.com/product/237,Generic,Living Room - Accent Chairs
235,"Classic Set Coffee Table ","Our coffee tables are more than just furniture — they’re the centerpiece of your living space. At Bobby Furniture Kenya, we design coffee tables that blend style, function, and durability. Whether you're looking for a sleek modern piece, a rustic wooden charm, or a minimalist glass-top design, we have options to suit every taste and space. Perfect for hosting, displaying décor, or simply relaxing with a cup of coffee, our tables add warmth and elegance to any room. Crafted with quality materials and attention to detail, a Bobby coffee table transforms your living room into a stylish, inviting space.
",32000.00 KES,null,in stock,new,https://res.cloudinary.com/dtz6b2pip/image/upload/v1748040112/20250524_014103_ccg0gx.jpg,https://bobbyfurniturekenya.com/product/235,Generic,Living Room - Coffee Tables
233,Amiens Classic Stand,"At Bobby Furniture Kenya, our TV stands are crafted to blend functionality with style, bringing elegance and organization to your living room. Designed with modern Kenyan homes in mind, our stands offer ample storage space for your TV, media devices, and decorative items. Whether you prefer sleek contemporary designs, rustic wooden finishes, or bold statement pieces, we have a variety to match your style and space. Each piece is built with quality materials to ensure durability, easy cable management, and a neat entertainment setup. Upgrade your viewing experience with a TV stand that stands out.",24000.00 KES,null,in stock,new,https://res.cloudinary.com/dtz6b2pip/image/upload/v1748039721/20250524_013419_fwanqi.jpg,https://bobbyfurniturekenya.com/product/233,Generic,Living Room - TV Stands
231,Bunbury Classic Stand,"Bobby Furniture Kenya, our TV stands are crafted to blend functionality with style, bringing elegance and organization to your living room. Designed with modern Kenyan homes in mind, our stands offer ample storage space for your TV, media devices, and decorative items. Whether you prefer sleek contemporary designs, rustic wooden finishes, or bold statement pieces, we have a variety to match your style and space. Each piece is built with quality materials to ensure durability, easy cable management, and a neat entertainment setup. Upgrade your viewing experience with a TV stand that stands out.
",25000.00 KES,null,in stock,new,https://res.cloudinary.com/dtz6b2pip/image/upload/v1748038642/20250524_011513_gasqoh.jpg,https://bobbyfurniturekenya.com/product/231,Generic,Living Room - TV Stands
114,Round Nesting Coffee Table Set,"This round nesting coffee table set offers a smart, space-saving design perfect for modern living rooms. The main round table is paired with four curved nesting stools that slide neatly underneath when not in use, keeping your space clean and organized. Crafted from strong hardwood and finished in a rich mahogany polish, this set adds elegance and practicality to any home. Ideal for small spaces, apartments, lounges, and reception areas.",45000.00 KES,null,in stock,new,https://res.cloudinary.com/dtz6b2pip/image/upload/v1768919827/20251125_170203_ugjepo.jpg,https://bobbyfurniturekenya.com/product/114,Generic,Living Room - Coffee Tables
241,Classic Black & White Stand,"At Bobby Furniture Kenya, our TV stands are crafted to blend functionality with style, bringing elegance and organization to your living room. Designed with modern Kenyan homes in mind, our stands offer ample storage space for your TV, media devices, and decorative items. Whether you prefer sleek contemporary designs, rustic wooden finishes, or bold statement pieces, we have a variety to match your style and space. Each piece is built with quality materials to ensure durability, easy cable management, and a neat entertainment setup. Upgrade your viewing experience with a TV stand that stands out.",32000.00 KES,null,in stock,new,https://res.cloudinary.com/dtz6b2pip/image/upload/v1748041221/20250524_015616_knhgxn.jpg,https://bobbyfurniturekenya.com/product/241,Generic,Living Room - TV Stands
245,"Fire Place Tv Stand ","At Bobby Furniture Kenya, our TV stands are crafted to blend functionality with style, bringing elegance and organization to your living room. Designed with modern Kenyan homes in mind, our stands offer ample storage space for your TV, media devices, and decorative items. Whether you prefer sleek contemporary designs, rustic wooden finishes, or bold statement pieces, we have a variety to match your style and space. Each piece is built with quality materials to ensure durability, easy cable management, and a neat entertainment setup. Upgrade your viewing experience with a TV stand that stands out.",32000.00 KES,null,in stock,new,https://res.cloudinary.com/dtz6b2pip/image/upload/v1748041223/20250524_015625_eaof51.jpg,https://bobbyfurniturekenya.com/product/245,Generic,Living Room - TV Stands
238,Wing Chairs With footrest,"Make a bold statement with our elegant wing chairs — the perfect blend of classic charm and modern comfort. Designed with high backs, graceful “wings,” and plush cushioning, our wing chairs offer both support and style. Whether used as a reading nook accent, a statement piece in your living room, or a cozy corner addition, Bobby Furniture Kenya’s wing chairs bring sophistication and relaxation to any space. Upholstered in premium fabrics and crafted with durable frames, they’re built to offer timeless beauty and lasting comfort.

",68000.00 KES,null,in stock,new,https://res.cloudinary.com/dtz6b2pip/image/upload/v1748040114/20250524_013952_trnnzk.jpg,https://bobbyfurniturekenya.com/product/238,Generic,Living Room - Accent Chairs
188,"3 Seater Light Grey Semi Recliner ","A 3 seater recliner is a spacious and luxurious seating arrangement designed for maximum comfort and functionality. It typically includes:  Three recliner seats (manual or electric) that allow users to lean back and elevate their feet.  Upholstery made of plush fabric, faux leather, or genuine leather for a soft and stylish finish.  Ample seating space for seven people, arranged in an L-shape or U-shape to suit living room layouts.  Padded armrests and backrests for enhanced comfort.",35000.00 KES,null,in stock,new,https://res.cloudinary.com/dtz6b2pip/image/upload/v1748022014/20250523_203918_eh1w6d.jpg,https://bobbyfurniturekenya.com/product/188,Generic,Living Room - Semi Recliners
186,7 seater Grey Semi Recliner,"A seven-seater recliner is a spacious and luxurious seating arrangement designed for maximum comfort and functionality. It typically includes:

Three recliner seats (manual or electric) that allow users to lean back and elevate their feet.

Upholstery made of plush fabric, faux leather, or genuine leather for a soft and stylish finish.

Ample seating space for seven people, arranged in an L-shape or U-shape to suit living room layouts.

Padded armrests and backrests for enhanced comfort.


",95000.00 KES,null,in stock,new,https://res.cloudinary.com/dtz6b2pip/image/upload/v1748021004/20250523_202306_exfrug.jpg,https://bobbyfurniturekenya.com/product/186,Generic,Living Room - Semi Recliners
246,"BobbyLux Classic Dressing Mirror ","A dressing mirror is a full-length or medium-sized mirror designed to help individuals view themselves while getting dressed or grooming. It is typically placed in bedrooms, dressing rooms, or closets.

Here are key features of a dressing mirror:

Full-body view: Most dressing mirrors are tall enough to reflect the entire body, making them ideal for checking outfits from head to toe.

Frame styles: They come in a variety of frames—wooden, metal, plastic, or frameless—to match different interior decor themes.

Mounting options: Dressing mirrors can be wall-mounted, free-standing with a stand or easel back, or integrated into a wardrobe or vanity unit.

Added features: Some may include storage compartments, LED lighting, or tilting functions for better angle adjustment.",34000.00 KES,null,in stock,new,https://res.cloudinary.com/dtz6b2pip/image/upload/v1748041257/20250524_015717_kld4f3.jpg,https://bobbyfurniturekenya.com/product/246,Generic,Bedroom - Dressers
2,Dining Table,Elegant wooden dining table for 6 people,35000.00 KES,null,in stock,new,https://example.com/table1.jpg,https://bobbyfurniturekenya.com/product/2,Generic,dining-room
115,6-Seater Mahogany Oval Dining Table Set,"This 6-seater mahogany oval dining table set blends timeless craftsmanship with modern comfort. The polished mahogany tabletop offers a rich, elegant finish supported by sturdy curved hardwood legs. It is paired with six upholstered dining chairs featuring soft brown velvet, tufted backs, and studded edging for added luxury. Perfect for family homes, dining rooms, restaurants, and upscale spaces, this set delivers durability, style, and everyday comfort.",65000.00 KES,null,in stock,new,https://res.cloudinary.com/dtz6b2pip/image/upload/v1768920328/20251126_175239_rjvfvs.jpg,https://bobbyfurniturekenya.com/product/115,Generic,Dining Room - Six Seater Dining Sets
250,9.5Inch Maharaja Pocket Coil Spring Mattress(5*6),"The Maharaja Pocket Coil Spring Mattress offers premium comfort, superior body support, and long-lasting durability. Designed with individually wrapped pocket springs, this mattress adapts to your body shape, reduces motion transfer, and provides targeted spinal support. The multi-layered quilted top adds extra softness while maintaining excellent airflow for a cooler, more restful sleep. Its firm yet comfortable structure makes it ideal for couples, adults, and anyone seeking a high-quality orthopedic sleep experience. Perfect for home bedrooms, guest rooms, and luxury accommodations.",33000.00 KES,null,in stock,new,https://res.cloudinary.com/dtz6b2pip/image/upload/v1768984835/20260121_103713_kdisbq.jpg,https://bobbyfurniturekenya.com/product/250,Generic,Mattresses - Spring Mattresses
7,"Mwendo Pole 7-Seater Grey ","The Mwendo Pole 7-Seater Sofa is a spacious and stylish seating solution designed for comfort and elegance.  While specific details about this model are limited, similar 7-seater sofas typically feature a combination of a 3-seater, 2-seater, and two single chairs, providing ample seating for families or guests.  These sofas often come with plush cushions, durable upholstery, and sturdy frames to ensure long-lasting use. 
",105000.00 KES,null,in stock,new,https://res.cloudinary.com/dtz6b2pip/image/upload/v1748118908/20250524_233323_wzygjd.jpg,https://bobbyfurniturekenya.com/product/7,Generic,Living Room - Couches in Set
8,Nairobi Nest 6-Seater Nevy Blue,"Upgrade your living space with this elegant Navy Blue L-Shaped Sofa, designed for both comfort and style. Upholstered in premium navy blue fabric, this modern sectional features plush cushioning and a spacious layout, perfect for lounging or entertaining guests.

Key features include:

Integrated Cupholders for added convenience

Deep, supportive seating with high-density foam

Sturdy hardwood frame for long-lasting durability

Reversible Chaise to suit any room layout

Sleek, contemporary design that complements modern interiors",65000.00 KES,null,in stock,new,https://res.cloudinary.com/dtz6b2pip/image/upload/v1748118907/20250524_233258_mrjew6.jpg,https://bobbyfurniturekenya.com/product/8,Generic,Living Room - Sectional Sofas
6,"Snuggle Bench Dark Grey ","A loveseat is a small sofa designed to seat two people comfortably. It's often used in living rooms, bedrooms, or cozy spaces where a full-sized sofa might be too large. The term ""love couch"" is a less common but descriptive variation of ""loveseat."" ",29000.00 KES,null,in stock,new,https://res.cloudinary.com/dtz6b2pip/image/upload/v1748118908/20250524_233229_gaz2yn.jpg,https://bobbyfurniturekenya.com/product/6,Generic,living-room
4,Dark Grey Semi Recliner 7-Seater,"A semi recliner is a chair that allows partial reclining, offering a slight backward tilt and elevated footrest for added comfort without fully lying back.

",100000.00 KES,null,in stock,new,https://res.cloudinary.com/dtz6b2pip/image/upload/v1748118908/20250524_233313_pi6agd.jpg,https://bobbyfurniturekenya.com/product/4,Generic,living-room
5,Nori Nevy Blue 5-Seater,"Nori is a  blue 5-seater with cup holders and golden details is a stylish and functional sofa set. It features rich blue upholstery, built-in cup holders for convenience, and elegant golden accents that add a touch of luxury to your living space.
",52000.00 KES,null,in stock,new,https://res.cloudinary.com/dtz6b2pip/image/upload/v1748118909/20250524_233248_rtq6tx.jpg,https://bobbyfurniturekenya.com/product/5,Generic,Living Room - Couches in Set
209,"4 Seater Chester Barizi Coach ","Elevate your space with our Chesterfield Seat – a luxurious blend of tradition and comfort. Handcrafted with precision, this statement piece features deep button tufting, gracefully rolled arms, and a solid hardwood frame. Upholstered in premium fabric or leather of your choice, it’s perfect for both modern and classic interiors. Ideal for your living room, office, or reception area.

Premium tufted design

High-density cushions for extra comfort

Durable wood frame and quality finishing

Available in a variety of colors and textures",48000.00 KES,null,in stock,new,https://res.cloudinary.com/dtz6b2pip/image/upload/v1748030083/20250523_225406_uz66ge.jpg,https://bobbyfurniturekenya.com/product/209,Generic,Living Room - Sofas
203,"Nyumbani Lounge 6 Seater ","A 6-seater Nyumbani Lounge is an expansive and elegant addition to any living space, designed to bring both comfort and sophistication. Its generous proportions and modular layout allow for a harmonious blend of style and functionality. With its extended frame, well-cushioned surfaces, and thoughtfully positioned armrests, it offers ample room for gatherings or quiet relaxation. The refined upholstery and sturdy construction make it a timeless centerpiece, perfect for hosting guests or enjoying everyday moments with family.

",62000.00 KES,null,in stock,new,https://res.cloudinary.com/dtz6b2pip/image/upload/v1748028676/20250523_223024_ietwqa.jpg,https://bobbyfurniturekenya.com/product/203,Generic,Living Room - Couches in set
9,"Mwendo Pole 5-Seater Couch ","Experience the perfect blend of tradition and comfort with the Mwendo Pole 5-Seater Sofa. Designed with a spacious layout and firm yet cozy cushions, this sofa brings timeless charm to your living space. Its name, ""Mwendo Pole"" (meaning ""slow pace"" in Swahili), reflects the relaxed, inviting atmosphere it creates in your home.

Features:

Seats up to 5 people comfortably – ideal for family and guests

Traditional curved armrests for classic elegance

Sturdy wooden frame built for durability

Premium fabric upholstery available in warm, earthy tones

Supportive backrest and deep cushioning for all-day comfort",98000.00 KES,null,in stock,new,https://res.cloudinary.com/dtz6b2pip/image/upload/v1748118907/20250524_233352_r99wzg.jpg,https://bobbyfurniturekenya.com/product/9,Generic,Living Room - Couches in Set
11,Raha Corner. 9-Seater,"Transform your living space with the spacious and stylish 9-Seater Corner Sofa—perfect for large families or those who love to host. Designed to offer maximum seating without compromising on comfort, this L-shaped masterpiece fits beautifully into any corner, making the most of your room.

Features:

Generously seats up to 9 people – ideal for big gatherings

Modern corner design to maximize space

High-density cushions for deep, supportive comfort

Strong hardwood frame for durability and long-term use

Premium fabric or leather options to suit any décor",78000.00 KES,null,in stock,new,https://res.cloudinary.com/dtz6b2pip/image/upload/v1748123372/20250525_004359_njogdx.jpg,https://bobbyfurniturekenya.com/product/11,Generic,Living Room - Sectional Sofas
116,Brown Mirror-Framed 6-Drawer Dressing Table,"This brown mirror-framed 6-drawer dressing table offers a stylish and functional design perfect for modern bedrooms. The large decorative mirror features a bold geometric frame, adding elegance and enhancing room brightness. The spacious six drawers provide ample storage for cosmetics, jewelry, accessories, and personal essentials. Finished in a rich brown polish with gold knobs, this dressing table combines durability, practicality, and a luxurious contemporary look.",38000.00 KES,null,in stock,new,https://res.cloudinary.com/dtz6b2pip/image/upload/v1768920729/20251127_140537_lwmqvs.jpg,https://bobbyfurniturekenya.com/product/116,Generic,Bedroom - Dressers
